{
  "id": "infant-development-feeding",
  "section": "Peds Module",
  "category": "Neonatology",
  "title": "Developmental Milestones & Infant Feeding",
  "aliases": ["developmental milestones", "CDC AAP 2022 milestones", "classical milestones 50th percentile", "infant feeding schedule", "complementary feeding", "early allergen introduction", "foods to avoid first year"],
  "tags": ["development", "milestones", "infant feeding", "weaning", "complementary feeding", "well-child", "neonatology"],
  "contentType": "peds-tool",
  "content_version": 1,
  "last_reviewed": "2026-09-03",
  "next_review_due": "2027-09-03",
  "review_tier": 1,
  "sources": [
    "Critical Vector — Neonatology Pocket Guide: Developmental Milestones; Infant Feeding",
    "Zubler J et al. Pediatrics 2022 (CDC/AAP milestone revision); WHO/UNICEF infant feeding; NIAID 2017 peanut-allergy addendum"
  ],
  "changelog": [{ "version": 1, "date": "2026-09-03", "change": "Initial entry — classical (50th-percentile) vs CDC/AAP 2022 (75th-percentile) milestones, vision/hearing, WHO/AAP feeding schedule, foods to avoid, and early allergen introduction." }],
  "kind": "reference",
  "purpose": "Two milestone frameworks side by side — the classical board/teaching ages (50th percentile) and the CDC/AAP 2022 surveillance checklists (75th percentile). Label which you are using; they are not interchangeable. Plus the current infant feeding schedule.",
  "ageRange": "Birth to ~ 5 years (milestones); birth to ~ 24 months (feeding)",
  "sourceOfTruth": ["childhood-immunization-schedule"],
  "body": [
    { "type": "callout", "tone": "info", "text": "The CDC/AAP 2022 revision moved several milestones later (e.g. concern for not walking: from 12–18 mo to 18 mo; crawling removed as a required milestone) and added 15- and 30-month checklists. These are surveillance/conversation tools — formal delay screening still uses ASQ-3 / M-CHAT." },
    { "type": "heading", "level": 2, "text": "Milestones — classical (50th %ile, board standard)" },
    { "type": "table",
      "columns": ["Age", "Gross motor", "Language", "Social"],
      "rows": [
        ["2 mo", "Lifts head", "Coos", "Social smile"],
        ["4 mo", "Rolls; steady head", "Laughs", "Enjoys play"],
        ["6–7 mo", "Sits without support", "Babbles", "Stranger anxiety"],
        ["9 mo", "Pulls to stand, crawls", "—", "Waves bye-bye"],
        ["12 mo", "Walks alone (range 9–15 mo)", "1–2 words besides mama/dada", "Uses a spoon, imitates"],
        ["2 yr", "Runs, jumps, kicks a ball, up steps", "2-word phrases", "Parallel play"],
        ["3 yr", "Pedals a tricycle", "3-word sentences, ~ 75% intelligible to a stranger", "Toilet trained"],
        ["4 yr", "Hops on one foot", "Speaks clearly, tells stories", "Cooperative, imaginative play"],
        ["5 yr", "Skips, balances well", "Counts, knows colours", "Follows rules in games"]
      ]
    },
    { "type": "heading", "level": 2, "text": "Milestones — CDC/AAP 2022 (75th %ile, current screening)" },
    { "type": "table",
      "columns": ["Age", "Selected milestone", "Note"],
      "rows": [
        ["6 mo", "Rolls both ways; brings things to the mouth", ""],
        ["9 mo", "Sits without support; looks for a dropped object", ""],
        ["12 mo", "Pulls to stand; cruises (walks holding on)", "Independent walking flagged later than the classical chart"],
        ["15 mo", "Walks alone; tries 2–3 words", "New checklist age (2022)"],
        ["18 mo", "Walks up steps holding on; ~ 10 words", "Concern for non-walking now flagged here, not 12 mo"],
        ["2 yr", "Runs; kicks a ball; 2-word phrases", ""],
        ["30 mo", "~ 50-word vocabulary; puts 2+ words together", "New checklist age (2022)"]
      ]
    },
    { "type": "heading", "level": 3, "text": "Vision & hearing" },
    { "type": "list", "items": [
      "Vision: newborn fixes on a face (acuity ~ 20/200–20/400); follows horizontally by 1–2 mo; ~ 20/20 by 5–6 yr.",
      "Hearing: newborn startles/blinks to a loud noise; quiets or smiles to sound by 4 mo; turns to voice by 7 mo; responds to own name by 12 mo. A confirmed failed newborn hearing screen → audiology by 3 months."
    ] },
    { "type": "heading", "level": 2, "text": "Infant feeding (WHO / AAP)" },
    { "type": "table",
      "columns": ["Age", "Recommendation"],
      "rows": [
        ["0–6 months", "Exclusive breastfeeding on demand (~ 8–12 feeds/24 h); no water, juice, or solids needed. Iron-fortified formula if not breastfeeding"],
        ["~ 6 months", "Introduce iron-rich complementary foods (fortified cereal, puréed meat, legumes, mashed egg) while continuing breast milk/formula"],
        ["9–12 months", "Soft mashed family foods, minced meat/fish, cooked vegetables, yoghurt, soft finger foods"],
        ["12–24 months", "Family foods in small pieces; whole cow's milk now acceptable as the main milk; encourage self-feeding; limit juice and sweets"]
      ]
    },
    { "type": "callout", "tone": "warning", "text": "Before 12 months, avoid honey (infant botulism) and cow's milk as the primary drink (low iron, high renal solute load). Post-LEAP: introduce allergenic foods (peanut, egg) around 4–6 months rather than delaying them — earlier for an infant with severe eczema or egg allergy (specialist-guided). Choking hazards through age ~ 4: whole grapes, nuts, hot dog rounds, hard raw vegetables, popcorn." }
  ],
  "buildNote": "Two milestone frameworks kept side by side deliberately — label the one in use when charting."
}
