{
  "id": "neonatal-hypoglycemia",
  "section": "Peds Module",
  "category": "Neonatology",
  "title": "Neonatal Hypoglycemia — Screening & Management",
  "settingEmphasis": [
    "ed",
    "icu"
  ],
  "audience": [
    "neonate"
  ],
  "aliases": [
    "newborn low blood sugar",
    "neonatal glucose screening",
    "dextrose gel newborn"
  ],
  "tags": [
    "neonatal hypoglycemia",
    "dextrose gel",
    "newborn glucose",
    "at-risk newborn",
    "neonatology",
    "ED",
    "ICU"
  ],
  "keywords": [
    "screening thresholds and timing genuinely vary across major guidelines, AAP/BAPM/PES don't all agree on the exact number, know your institution's chosen threshold rather than assuming one universal cutoff",
    "targeted screening of at-risk newborns, not every newborn, the at-risk groups are infant of a diabetic mother, large or small for gestational age, late preterm, and perinatally stressed",
    "40 percent oral dextrose gel is now first-line for an asymptomatic or mildly symptomatic at-risk newborn with a low glucose, it reduces the need for IV dextrose and NICU admission in selected cases",
    "a SYMPTOMATIC hypoglycemic newborn — jitteriness, poor feeding, lethargy, seizure, apnea — gets treated immediately and more aggressively regardless of the exact number, symptoms change the calculus",
    "this is the general newborn screening and management protocol, for the infant-of-a-diabetic-mother-specific mechanism and macrosomia/lung-maturation context, see that dedicated module"
  ],
  "contentType": "peds-tool",
  "content_version": 2,
  "last_reviewed": "2026-09-15",
  "next_review_due": "2026-12-15",
  "review_tier": 1,
  "sources": [
    "Neonatal Hypoglycemia: A Systematic Review of International and Local Clinical Guidelines with Clinical Implications. J Clin Med. 2026;15(10):3921.",
    "Adamkin DH, Committee on Fetus and Newborn. Postnatal Glucose Homeostasis in Late-Preterm and Term Infants. Pediatrics. 2011;127(3):575-579.",
    "Harris DL, et al. Dextrose Gel for Neonatal Hypoglycaemia (the Sugar Babies Study): a randomised, double-blind, placebo-controlled trial. Lancet. 2013;382(9910):2077-2083."
  ],
  "changelog": [
    {
      "version": 1,
      "date": "2026-09-15",
      "change": "Initial entry — a genuine content gap (Content audit 2026-09-15, fresh-look Batch 7). The existing infant-of-diabetic-mother module covers neonatal hypoglycemia specifically in that IDM context; this is the general at-risk-newborn screening/management protocol applicable to every risk category, cross-referenced rather than duplicated."
    },
    {
      "version": 2,
      "date": "2026-09-25",
      "change": "Reformatted for reading on a phone: long paragraphs broken into short paragraphs and lists. Wording and clinical content unchanged."
    }
  ],
  "kind": "reference",
  "purpose": "General screening and stepwise management of neonatal hypoglycemia in at-risk newborns — targeted screening, symptom-driven urgency, and dextrose gel as first-line for the asymptomatic/mildly symptomatic case.",
  "ageRange": "Newborns, primarily the first 24-48 hours of life (the period of physiologic glucose nadir/transition).",
  "sourceOfTruth": [
    "infant-of-diabetic-mother"
  ],
  "body": [
    {
      "type": "callout",
      "tone": "info",
      "text": "Screening thresholds and timing genuinely vary across major guideline bodies (AAP, BAPM, PES, and others) — there is no single universally agreed minimum glucose number or screening schedule. Know and follow your institution's chosen protocol/threshold rather than assuming one fixed number applies everywhere; this module presents the shared PRINCIPLES that are consistent across guidelines, not a single definitive cutoff."
    },
    {
      "type": "heading",
      "level": 2,
      "text": "Who to screen — targeted, not universal"
    },
    {
      "type": "text",
      "text": "All major guidelines agree on TARGETED screening of at-risk newborns rather than universal screening of every newborn. At-risk categories include:"
    },
    {
      "type": "list",
      "items": [
        "Infant of a diabetic mother (IDM) — see the dedicated infant-of-diabetic-mother module for the mechanism (maternal hyperglycemia → fetal hyperinsulinemia) and its other associated risks (macrosomia, delayed lung maturation).",
        "Large for gestational age (LGA) or small for gestational age (SGA).",
        "Late preterm (roughly 34-36 6/7 weeks gestation).",
        "Perinatally stressed infants (birth asphyxia, significant respiratory distress, hypothermia, sepsis, or other acute perinatal complications) — physiologic stress increases glucose utilization and can impair the normal counter-regulatory response.",
        "A well-appearing, term, appropriate-for-gestational-age newborn without any of these risk factors generally does NOT need routine glucose screening."
      ]
    },
    {
      "type": "heading",
      "level": 2,
      "text": "Symptomatic changes the calculus — treat immediately"
    },
    {
      "type": "callout",
      "tone": "danger",
      "text": "A SYMPTOMATIC hypoglycemic newborn — jitteriness/tremor, poor feeding, lethargy, hypotonia, temperature instability, apnea, or seizure — is treated immediately and more aggressively regardless of exactly how low the glucose number is. Symptoms indicate the newborn is not tolerating the current glucose level, and this should not wait on repeating the level or comparing it against a specific numeric threshold before acting."
    },
    {
      "type": "heading",
      "level": 2,
      "text": "Management — dextrose gel first-line for the well-appearing at-risk newborn"
    },
    {
      "type": "list",
      "items": [
        "For an ASYMPTOMATIC or MILDLY symptomatic at-risk newborn with a low glucose per your institution's threshold: feed the infant (breast or formula) AND give 40% oral dextrose gel massaged into the buccal mucosa — this combination has become first-line therapy over the past decade, meaningfully reducing the need for IV dextrose and NICU admission in appropriately selected cases (the Sugar Babies trial and subsequent guideline adoption).",
        "Recheck glucose after feeding/gel per protocol (commonly 30-60 minutes later) to confirm response.",
        "Persistently low glucose despite feeding and dextrose gel, or a SYMPTOMATIC/significantly low glucose from the outset, escalates to IV dextrose — typically a bolus (e.g. 2 mL/kg of D10W) followed by a continuous infusion titrated to maintain euglycemia, with NICU-level monitoring.",
        "Ongoing or recurrent hypoglycemia despite adequate glucose infusion rates warrants evaluation for a persistent hypoglycemia disorder (hyperinsulinism, metabolic/endocrine causes) rather than simply escalating the same supportive approach indefinitely — involve neonatology/endocrinology for a refractory case."
      ]
    },
    {
      "type": "heading",
      "level": 2,
      "text": "Why thresholds vary — and why that's okay"
    },
    {
      "type": "text",
      "text": "- the physiologic glucose nadir in the first hours of life\n- the balance between avoiding unnecessary intervention in a normal transitional process versus avoiding missed treatment of clinically significant hypoglycemia\n- differing evidence interpretations across guideline bodies\n\nAll contribute to the lack of a single universal number.\n\nWhat IS consistent across guidelines:\n- targeted screening of at-risk infants\n- immediate treatment of symptomatic hypoglycemia regardless of the exact number\n- dextrose gel as a now widely-endorsed first-line therapy for the well-appearing at-risk infant with a low but asymptomatic reading"
    }
  ],
  "buildNote": "peds-tool with kind=reference and sourceOfTruth pointing to infant-of-diabetic-mother for that specific mechanism/context, avoiding duplication — this module is the general at-risk-newborn protocol applicable across all risk categories (IDM, LGA/SGA, late preterm, perinatal stress). Deliberately avoided stating a single numeric glucose threshold, since WebSearch confirmed genuine, persistent disagreement across AAP/BAPM/PES and other major guideline bodies on the exact number and screening timing — presenting a fabricated single 'correct' threshold would be worse than presenting the shared principles and directing to institutional protocol. Dextrose-gel-as-first-line and the targeted-screening approach WebSearch-verified against the 2026 J Clin Med systematic review and the original Sugar Babies trial (Lancet 2013). peds-tool schema has no related[] field."
}
