{
  "id": "prematurity-complications",
  "section": "Peds Module",
  "category": "Neonatology",
  "title": "Prematurity — Classification & Complications by System",
  "settingEmphasis": ["icu"],
  "audience": ["neonate"],
  "aliases": ["preterm classification", "low birth weight VLBW ELBW", "extremely preterm", "problems of prematurity", "New Ballard Score", "NICU discharge criteria"],
  "tags": ["prematurity", "low birth weight", "NICU", "RDS", "IVH", "NEC", "retinopathy of prematurity", "neonatology"],
  "contentType": "peds-tool",
  "content_version": 1,
  "last_reviewed": "2026-09-03",
  "next_review_due": "2027-09-03",
  "review_tier": 1,
  "sources": ["Critical Vector — Neonatology Pocket Guide: Low Birth Weight & Prematurity", "WHO preterm classification (Blencowe, Lancet 2012)"],
  "changelog": [{ "version": 1, "date": "2026-09-03", "change": "Initial entry — weight and gestational-age classification, GA assessment, the problems-by-organ-system table, and discharge-readiness criteria." }],
  "kind": "reference",
  "purpose": "Classify by weight AND gestational age (they answer different questions), then run the organ-system checklist of prematurity complications and the discharge-readiness criteria.",
  "ageRange": "Preterm and low-birth-weight neonates",
  "sourceOfTruth": ["neonatal-rds", "neonatal-hie-cooling", "neonatal-jaundice", "nrp-algorithm"],
  "body": [
    { "type": "heading", "level": 2, "text": "Weight classification (independent of gestation)" },
    { "type": "table",
      "columns": ["Category", "Definition"],
      "rows": [
        ["Normal birth weight", "2500–3999 g"],
        ["Low birth weight (LBW)", "< 2500 g"],
        ["Very low birth weight (VLBW)", "< 1500 g"],
        ["Extremely low birth weight (ELBW)", "< 1000 g"],
        ["Macrosomia / LGA", "≥ 4000 g, or > 90th percentile for gestational age"]
      ]
    },
    { "type": "heading", "level": 2, "text": "Gestational-age classification (WHO 2012)" },
    { "type": "table",
      "columns": ["Category", "Gestational age"],
      "rows": [
        ["Extremely preterm", "< 28 weeks"],
        ["Very preterm", "28 to < 32 weeks"],
        ["Moderate to late preterm", "32 to < 37 weeks"],
        ["Term", "37 to < 42 weeks (early term 37–38+6, full term 39–40+6, late term 41+)"],
        ["Post-term", "≥ 42 weeks"]
      ]
    },
    { "type": "text", "text": "GA assessment: best is a first-trimester ultrasound; postnatally the New Ballard Score (6 physical + 6 neuromuscular maturity signs). LBW may be prematurity, growth restriction, or both — weight alone does not give the cause." },
    { "type": "heading", "level": 2, "text": "Problems of prematurity by system" },
    { "type": "table",
      "columns": ["System", "Problems"],
      "rows": [
        ["Respiratory", "RDS (surfactant deficiency), apnea of prematurity, bronchopulmonary dysplasia"],
        ["Neurologic", "Intraventricular hemorrhage, HIE, sepsis/meningitis; long-term cerebral palsy, hydrocephalus"],
        ["Cardiovascular", "Hypotension, patent ductus arteriosus, early heart failure"],
        ["Hematologic", "Anemia of prematurity, bleeding tendency, DIC"],
        ["GI", "Necrotising enterocolitis, feeding intolerance, exaggerated jaundice"],
        ["Metabolic", "Hypoglycemia, hypocalcemia"],
        ["Renal / thermal", "Poor water and solute handling; hypothermia (high surface-area-to-volume ratio, minimal subcutaneous fat)"],
        ["Immune / eye", "Relative immunodeficiency → infection risk; retinopathy of prematurity (screen and treat — can cause blindness)"]
      ]
    },
    { "type": "heading", "level": 2, "text": "Discharge readiness" },
    { "type": "list", "items": [
      "Consistent weight gain over several days.",
      "Full oral feeding, tolerating volumes (suck–swallow–breathe coordination is usually adequate ≥ 34 weeks postmenstrual age; NG/OG feeds until then).",
      "Stable temperature in an open cot.",
      "No apnea/bradycardia events for a defined observation window (commonly 5–7 days).",
      "Newborn hearing screen done; retinopathy-of-prematurity eye exam completed / follow-up arranged; car-seat tolerance test if indicated."
    ] }
  ],
  "buildNote": "System-by-system checklist for the preterm infant; links to the specific neonatology modules for management."
}
