{
  "id": "peds-glasgow-coma-scale",
  "section": "Peds Module",
  "category": "Peds Resuscitation & Decision Support",
  "title": "Pediatric Glasgow Coma Scale",
  "aliases": ["peds GCS", "pGCS", "children's coma scale"],
  "contentType": "peds-tool",
  "content_version": 1,
  "last_reviewed": "2026-08-31",
  "next_review_due": "2026-11-30",
  "review_tier": 1,
  "sources": ["Holmes JF et al. Acad Emerg Med 2005 (pediatric GCS validation)"],
  "changelog": [
    { "version": 1, "date": "2026-08-31", "change": "Initial entry — age-adjusted verbal scale for preverbal children." }
  ],
  "kind": "calculator",
  "purpose": "Age-adjusted GCS for preverbal/nonverbal children. Pediatric counterpart to the adult GCS entry in Calculators.",
  "ageRange": "< 2 years (modified verbal + motor); ≥ 2 years use the standard GCS",
  "sourceOfTruth": [],
  "embeddedCalculator": {
    "id": "peds-glasgow-coma-scale-calc",
    "section": "Peds Module",
    "category": "Peds Resuscitation & Decision Support",
    "title": "Pediatric GCS",
    "contentType": "calculator",
    "content_version": 1,
    "review_tier": 1,
    "last_reviewed": "2026-08-31",
    "next_review_due": "2026-11-30",
    "sources": ["Holmes JF et al. Acad Emerg Med 2005"],
    "engine": "additive",
    "purpose": "Age-adjusted coma scoring for preverbal children.",
    "items": [
      { "key": "eye", "label": "Eye opening", "options": [
        { "label": "Spontaneous", "points": 4 },
        { "label": "To sound / speech", "points": 3 },
        { "label": "To pressure", "points": 2 },
        { "label": "None", "points": 1 }
      ] },
      { "key": "verbal", "label": "Verbal response (infant-modified)", "options": [
        { "label": "Coos, babbles", "points": 5 },
        { "label": "Irritable cry, consolable", "points": 4 },
        { "label": "Cries to pain", "points": 3 },
        { "label": "Moans to pain", "points": 2 },
        { "label": "None", "points": 1 }
      ] },
      { "key": "motor", "label": "Motor response (infant-modified)", "options": [
        { "label": "Spontaneous / purposeful movement", "points": 6 },
        { "label": "Withdraws to touch", "points": 5 },
        { "label": "Withdraws to pain", "points": 4 },
        { "label": "Abnormal flexion (decorticate)", "points": 3 },
        { "label": "Abnormal extension (decerebrate)", "points": 2 },
        { "label": "None", "points": 1 }
      ] }
    ],
    "interpretation": [
      { "min": 13, "max": 15, "label": "Mild impairment", "severity": "low" },
      { "min": 9, "max": 12, "label": "Moderate impairment", "severity": "moderate" },
      { "min": 3, "max": 8, "label": "Severe impairment — secure airway (GCS ≤ 8)", "severity": "high" }
    ]
  },
  "buildNote": "The Peds Module composes rather than duplicates: this embeds a calculator definition so the Calculators engine renders it unchanged. For tools that only re-point at an existing dose table, use sourceOfTruth instead of embedding."
}
